date,time,country,level,summary,dateYear,dateMonth,dateDay,miltime,dateAdded
Tuesday August 01 2023,12:55 PM,US,1.0,Redbook YoY JUL/29,2023,8,1,12:55,2023-11-22 11:37:47
Tuesday August 01 2023,01:45 PM,US,2.0,S&P Global Manufacturing PMI Final JUL,2023,8,1,13:45,2023-11-22 11:37:47
Tuesday August 01 2023,02:00 PM,US,3.0,JOLTs Job Openings JUN,2023,8,1,14:00,2023-11-22 11:37:47
Tuesday August 01 2023,02:00 PM,US,3.0,ISM Manufacturing PMI JUL,2023,8,1,14:00,2023-11-22 11:37:47
Tuesday August 01 2023,02:00 PM,US,2.0,ISM Manufacturing Employment JUL,2023,8,1,14:00,2023-11-22 11:37:47
Tuesday August 01 2023,02:00 PM,US,1.0,ISM Manufacturing New Orders JUL,2023,8,1,14:00,2023-11-22 11:37:47
Tuesday August 01 2023,02:00 PM,US,1.0,ISM Manufacturing Prices JUL,2023,8,1,14:00,2023-11-22 11:37:47
Tuesday August 01 2023,02:00 PM,US,1.0,Construction Spending MoM JUN,2023,8,1,14:00,2023-11-22 11:37:47
Tuesday August 01 2023,02:00 PM,US,1.0,JOLTs Job Quits JUN,2023,8,1,14:00,2023-11-22 11:37:47
Tuesday August 01 2023,02:30 PM,US,1.0,Dallas Fed Services Index JUL,2023,8,1,14:30,2023-11-22 11:37:47
Tuesday August 01 2023,02:30 PM,US,1.0,Dallas Fed Services Revenues Index JUL,2023,8,1,14:30,2023-11-22 11:37:47
Tuesday August 01 2023,08:30 PM,US,2.0,API Crude Oil Stock Change JUL/28,2023,8,1,20:30,2023-11-22 11:37:47
Tuesday August 01 2023,08:00 PM,US,1.0,LMI Logistics Managers Index Current JUL,2023,8,1,20:00,2023-11-22 11:37:47
Wednesday August 02 2023,11:00 AM,US,2.0,MBA 30-Year Mortgage Rate JUL/28,2023,8,2,11:00,2023-11-22 11:37:47
Wednesday August 02 2023,11:00 AM,US,1.0,MBA Mortgage Market Index JUL/28,2023,8,2,11:00,2023-11-22 11:37:47
Wednesday August 02 2023,11:00 AM,US,1.0,MBA Mortgage Refinance Index JUL/28,2023,8,2,11:00,2023-11-22 11:37:47
Wednesday August 02 2023,11:00 AM,US,1.0,MBA Purchase Index JUL/28,2023,8,2,11:00,2023-11-22 11:37:47
Wednesday August 02 2023,11:00 AM,US,1.0,MBA Mortgage Applications JUL/28,2023,8,2,11:00,2023-11-22 11:37:47
Wednesday August 02 2023,12:15 PM,US,2.0,ADP Employment Change JUL,2023,8,2,12:15,2023-11-22 11:37:47
Wednesday August 02 2023,02:30 PM,US,2.0,EIA Crude Oil Stocks Change JUL/28,2023,8,2,14:30,2023-11-22 11:37:47
Wednesday August 02 2023,02:30 PM,US,2.0,EIA Gasoline Stocks Change JUL/28,2023,8,2,14:30,2023-11-22 11:37:47
Wednesday August 02 2023,02:30 PM,US,1.0,EIA Heating Oil Stocks Change JUL/28,2023,8,2,14:30,2023-11-22 11:37:47
Wednesday August 02 2023,02:30 PM,US,1.0,EIA Refinery Crude Runs Change JUL/28,2023,8,2,14:30,2023-11-22 11:37:47
Wednesday August 02 2023,02:30 PM,US,1.0,EIA Cushing Crude Oil Stocks Change JUL/28,2023,8,2,14:30,2023-11-22 11:37:47
Wednesday August 02 2023,02:30 PM,US,1.0,EIA Distillate Fuel Production Change JUL/28,2023,8,2,14:30,2023-11-22 11:37:47
Wednesday August 02 2023,02:30 PM,US,1.0,EIA Distillate Stocks Change JUL/28,2023,8,2,14:30,2023-11-22 11:37:47
Wednesday August 02 2023,02:30 PM,US,1.0,EIA Gasoline Production Change JUL/28,2023,8,2,14:30,2023-11-22 11:37:47
Wednesday August 02 2023,02:30 PM,US,1.0,EIA Crude Oil Imports Change JUL/28,2023,8,2,14:30,2023-11-22 11:37:47
Wednesday August 02 2023,08:00 PM,US,1.0,Treasury Refunding Announcement,2023,8,2,20:00,2023-11-22 11:37:47
Wednesday August 02 2023,08:00 PM,US,1.0,Total Vehicle Sales JUL,2023,8,2,20:00,2023-11-22 11:37:47
Thursday August 03 2023,11:30 AM,US,1.0,Challenger Job Cuts JUL,2023,8,3,11:30,2023-11-22 11:37:47
Thursday August 03 2023,12:30 PM,US,2.0,Initial Jobless Claims JUL/29,2023,8,3,12:30,2023-11-22 11:37:47
Thursday August 03 2023,12:30 PM,US,2.0,Unit Labour Costs QoQ Prel Q2,2023,8,3,12:30,2023-11-22 11:37:47
Thursday August 03 2023,12:30 PM,US,2.0,Nonfarm Productivity QoQ Prel Q2,2023,8,3,12:30,2023-11-22 11:37:47
Thursday August 03 2023,12:30 PM,US,1.0,Jobless Claims 4-week Average JUL/29,2023,8,3,12:30,2023-11-22 11:37:47
Thursday August 03 2023,12:30 PM,US,1.0,Continuing Jobless Claims JUL/22,2023,8,3,12:30,2023-11-22 11:37:47
Thursday August 03 2023,01:45 PM,US,2.0,S&P Global Composite PMI Final JUL,2023,8,3,13:45,2023-11-22 11:37:47
Thursday August 03 2023,01:45 PM,US,2.0,S&P Global Services PMI Final JUL,2023,8,3,13:45,2023-11-22 11:37:47
Thursday August 03 2023,02:00 PM,US,3.0,ISM Services PMI JUL,2023,8,3,14:00,2023-11-22 11:37:47
Thursday August 03 2023,02:00 PM,US,2.0,Factory Orders MoM JUN,2023,8,3,14:00,2023-11-22 11:37:47
Thursday August 03 2023,02:00 PM,US,2.0,ISM Services Employment JUL,2023,8,3,14:00,2023-11-22 11:37:47
Thursday August 03 2023,02:00 PM,US,1.0,ISM Services New Orders JUL,2023,8,3,14:00,2023-11-22 11:37:47
Thursday August 03 2023,02:00 PM,US,1.0,ISM Services Prices JUL,2023,8,3,14:00,2023-11-22 11:37:47
Thursday August 03 2023,02:00 PM,US,1.0,Factory Orders ex Transportation JUN,2023,8,3,14:00,2023-11-22 11:37:47
Thursday August 03 2023,02:00 PM,US,1.0,ISM Services Business Activity JUL,2023,8,3,14:00,2023-11-22 11:37:47
Thursday August 03 2023,02:30 PM,US,1.0,EIA Natural Gas Stocks Change JUL/28,2023,8,3,14:30,2023-11-22 11:37:47
Thursday August 03 2023,03:30 PM,US,1.0,4-Week Bill Auction,2023,8,3,15:30,2023-11-22 11:37:47
Thursday August 03 2023,03:30 PM,US,1.0,8-Week Bill Auction,2023,8,3,15:30,2023-11-22 11:37:47
Thursday August 03 2023,04:00 PM,US,1.0,15-Year Mortgage Rate AUG/02,2023,8,3,16:00,2023-11-22 11:37:47
Thursday August 03 2023,04:00 PM,US,1.0,30-Year Mortgage Rate AUG/02,2023,8,3,16:00,2023-11-22 11:37:47
Friday August 04 2023,12:30 PM,US,3.0,Non Farm Payrolls JUL,2023,8,4,12:30,2023-11-22 11:37:47
Friday August 04 2023,12:30 PM,US,3.0,Unemployment Rate JUL,2023,8,4,12:30,2023-11-22 11:37:47
Friday August 04 2023,12:30 PM,US,2.0,Average Hourly Earnings MoM JUL,2023,8,4,12:30,2023-11-22 11:37:47
Friday August 04 2023,12:30 PM,US,2.0,Average Hourly Earnings YoY JUL,2023,8,4,12:30,2023-11-22 11:37:47
Friday August 04 2023,12:30 PM,US,2.0,Participation Rate JUL,2023,8,4,12:30,2023-11-22 11:37:47
Friday August 04 2023,12:30 PM,US,1.0,Manufacturing Payrolls JUL,2023,8,4,12:30,2023-11-22 11:37:47
Friday August 04 2023,12:30 PM,US,1.0,Average Weekly Hours JUL,2023,8,4,12:30,2023-11-22 11:37:47
Friday August 04 2023,12:30 PM,US,1.0,Government Payrolls JUL,2023,8,4,12:30,2023-11-22 11:37:47
Friday August 04 2023,12:30 PM,US,1.0,Nonfarm Payrolls Private JUL,2023,8,4,12:30,2023-11-22 11:37:47
Friday August 04 2023,12:30 PM,US,1.0,U-6 Unemployment Rate JUL,2023,8,4,12:30,2023-11-22 11:37:47
Friday August 04 2023,05:00 PM,US,1.0,Baker Hughes Oil Rig Count AUG/04,2023,8,4,17:00,2023-11-22 11:37:47
Friday August 04 2023,05:00 PM,US,1.0,Baker Hughes Total Rig Count AUG/04,2023,8,4,17:00,2023-11-22 11:37:47
Monday August 07 2023,03:30 PM,US,1.0,3-Month Bill Auction,2023,8,7,15:30,2023-11-22 11:37:47
Monday August 07 2023,03:30 PM,US,1.0,6-Month Bill Auction,2023,8,7,15:30,2023-11-22 11:37:47
Monday August 07 2023,07:00 PM,US,1.0,Consumer Credit Change JUN,2023,8,7,19:00,2023-11-22 11:37:47
Monday August 07 2023,08:00 PM,US,1.0,Used Car Prices MoM JUL,2023,8,7,20:00,2023-11-22 11:37:47
Monday August 07 2023,08:00 PM,US,1.0,Used Car Prices YoY JUL,2023,8,7,20:00,2023-11-22 11:37:47
Tuesday August 08 2023,10:00 AM,US,1.0,NFIB Business Optimism Index JUL,2023,8,8,10:00,2023-11-22 11:37:47
Tuesday August 08 2023,12:30 PM,US,2.0,Exports JUN,2023,8,8,12:30,2023-11-22 11:37:47
Tuesday August 08 2023,12:30 PM,US,2.0,Imports JUN,2023,8,8,12:30,2023-11-22 11:37:47
Tuesday August 08 2023,12:30 PM,US,2.0,Balance of Trade JUN,2023,8,8,12:30,2023-11-22 11:37:47
Tuesday August 08 2023,12:30 PM,US,1.0,Total Household Debt Q2,2023,8,8,12:30,2023-11-22 11:37:47
Tuesday August 08 2023,12:55 PM,US,1.0,Redbook YoY AUG/05,2023,8,8,12:55,2023-11-22 11:37:47
Tuesday August 08 2023,02:00 PM,US,2.0,IBD/TIPP Economic Optimism AUG,2023,8,8,14:00,2023-11-22 11:37:47
Tuesday August 08 2023,02:00 PM,US,1.0,Wholesale Inventories MoM JUN,2023,8,8,14:00,2023-11-22 11:37:47
Tuesday August 08 2023,08:30 PM,US,2.0,API Crude Oil Stock Change AUG/04,2023,8,8,20:30,2023-11-22 11:37:47
Wednesday August 09 2023,11:00 AM,US,2.0,MBA 30-Year Mortgage Rate AUG/04,2023,8,9,11:00,2023-11-22 11:37:47
Wednesday August 09 2023,11:00 AM,US,1.0,MBA Mortgage Market Index AUG/04,2023,8,9,11:00,2023-11-22 11:37:47
Wednesday August 09 2023,11:00 AM,US,1.0,MBA Mortgage Refinance Index AUG/04,2023,8,9,11:00,2023-11-22 11:37:47
Wednesday August 09 2023,11:00 AM,US,1.0,MBA Purchase Index AUG/04,2023,8,9,11:00,2023-11-22 11:37:47
Wednesday August 09 2023,11:00 AM,US,1.0,MBA Mortgage Applications AUG/04,2023,8,9,11:00,2023-11-22 11:37:47
Tuesday July 18 2023,02:00 PM,US,2.0,Fed Barr Speech,2023,7,18,14:00,2023-11-22 11:37:47
Tuesday July 18 2023,02:00 PM,US,1.0,Fed Gibson Speech,2023,7,18,14:00,2023-11-22 11:37:47
Wednesday August 09 2023,02:30 PM,US,2.0,EIA Gasoline Stocks Change AUG/04,2023,8,9,14:30,2023-11-22 11:37:47
Wednesday August 09 2023,02:30 PM,US,2.0,EIA Crude Oil Stocks Change AUG/04,2023,8,9,14:30,2023-11-22 11:37:47
Wednesday August 09 2023,02:30 PM,US,1.0,EIA Cushing Crude Oil Stocks Change AUG/04,2023,8,9,14:30,2023-11-22 11:37:47
Wednesday August 09 2023,02:30 PM,US,1.0,EIA Distillate Fuel Production Change AUG/04,2023,8,9,14:30,2023-11-22 11:37:47
Wednesday August 09 2023,02:30 PM,US,1.0,EIA Distillate Stocks Change AUG/04,2023,8,9,14:30,2023-11-22 11:37:47
Wednesday August 09 2023,02:30 PM,US,1.0,EIA Gasoline Production Change AUG/04,2023,8,9,14:30,2023-11-22 11:37:47
Wednesday August 09 2023,02:30 PM,US,1.0,EIA Heating Oil Stocks Change AUG/04,2023,8,9,14:30,2023-11-22 11:37:47
Wednesday August 09 2023,02:30 PM,US,1.0,EIA Refinery Crude Runs Change AUG/04,2023,8,9,14:30,2023-11-22 11:37:47
Wednesday August 09 2023,02:30 PM,US,1.0,EIA Crude Oil Imports Change AUG/04,2023,8,9,14:30,2023-11-22 11:37:47
Thursday August 10 2023,12:30 PM,US,3.0,Core Inflation Rate YoY JUL,2023,8,10,12:30,2023-11-22 11:37:47
Thursday August 10 2023,12:30 PM,US,3.0,Core Inflation Rate MoM JUL,2023,8,10,12:30,2023-11-22 11:37:47
Thursday August 10 2023,12:30 PM,US,3.0,Inflation Rate YoY JUL,2023,8,10,12:30,2023-11-22 11:37:47
Thursday August 10 2023,12:30 PM,US,3.0,Inflation Rate MoM JUL,2023,8,10,12:30,2023-11-22 11:37:47
Thursday August 10 2023,12:30 PM,US,2.0,Initial Jobless Claims AUG/05,2023,8,10,12:30,2023-11-22 11:37:47
Thursday August 10 2023,12:30 PM,US,2.0,CPI JUL,2023,8,10,12:30,2023-11-22 11:37:47
Thursday August 10 2023,12:30 PM,US,2.0,CPI s.a JUL,2023,8,10,12:30,2023-11-22 11:37:47
Thursday August 10 2023,12:30 PM,US,1.0,Continuing Jobless Claims JUL/29,2023,8,10,12:30,2023-11-22 11:37:47
Thursday August 10 2023,12:30 PM,US,1.0,Jobless Claims 4-week Average AUG/05,2023,8,10,12:30,2023-11-22 11:37:47
Thursday August 10 2023,02:30 PM,US,1.0,EIA Natural Gas Stocks Change AUG/04,2023,8,10,14:30,2023-11-22 11:37:47
Thursday August 10 2023,03:30 PM,US,1.0,4-Week Bill Auction,2023,8,10,15:30,2023-11-22 11:37:47
Thursday August 10 2023,03:30 PM,US,1.0,8-Week Bill Auction,2023,8,10,15:30,2023-11-22 11:37:47
Thursday August 10 2023,04:00 PM,US,1.0,15-Year Mortgage Rate AUG/09,2023,8,10,16:00,2023-11-22 11:37:47
Thursday August 10 2023,04:00 PM,US,1.0,30-Year Mortgage Rate AUG/09,2023,8,10,16:00,2023-11-22 11:37:47
Thursday August 10 2023,06:00 PM,US,2.0,Monthly Budget Statement JUL,2023,8,10,18:00,2023-11-22 11:37:47
Friday August 11 2023,12:30 PM,US,3.0,PPI MoM JUL,2023,8,11,12:30,2023-11-22 11:37:47
Friday August 11 2023,12:30 PM,US,2.0,Core PPI MoM JUL,2023,8,11,12:30,2023-11-22 11:37:47
Friday August 11 2023,12:30 PM,US,1.0,Core PPI YoY JUL,2023,8,11,12:30,2023-11-22 11:37:47
Friday August 11 2023,12:30 PM,US,1.0,PPI YoY JUL,2023,8,11,12:30,2023-11-22 11:37:47
Friday August 11 2023,02:00 PM,US,3.0,Michigan Consumer Sentiment Prel AUG,2023,8,11,14:00,2023-11-22 11:37:47
Friday August 11 2023,02:00 PM,US,1.0,Michigan 5 Year Inflation Expectations Prel AUG,2023,8,11,14:00,2023-11-22 11:37:47
Friday August 11 2023,02:00 PM,US,1.0,Michigan Consumer Expectations Prel AUG,2023,8,11,14:00,2023-11-22 11:37:47
Friday August 11 2023,02:00 PM,US,1.0,Michigan Current Conditions Prel AUG,2023,8,11,14:00,2023-11-22 11:37:47
Friday August 11 2023,02:00 PM,US,1.0,Michigan Inflation Expectations Prel AUG,2023,8,11,14:00,2023-11-22 11:37:47
Friday August 11 2023,04:00 PM,US,1.0,WASDE Report,2023,8,11,16:00,2023-11-22 11:37:47
Friday August 11 2023,05:00 PM,US,1.0,Baker Hughes Oil Rig Count AUG/11,2023,8,11,17:00,2023-11-22 11:37:47
Friday August 11 2023,05:00 PM,US,1.0,Baker Hughes Total Rig Count AUG/11,2023,8,11,17:00,2023-11-22 11:37:47
Monday August 14 2023,03:00 PM,US,1.0,Consumer Inflation Expectations JUL,2023,8,14,15:00,2023-11-22 11:37:47
Monday August 14 2023,03:30 PM,US,1.0,3-Month Bill Auction,2023,8,14,15:30,2023-11-22 11:37:47
Monday August 14 2023,03:30 PM,US,1.0,6-Month Bill Auction,2023,8,14,15:30,2023-11-22 11:37:47
Tuesday August 15 2023,12:30 PM,US,3.0,Retail Sales MoM JUL,2023,8,15,12:30,2023-11-22 11:37:47
Tuesday August 15 2023,12:30 PM,US,2.0,Retail Sales Ex Autos MoM JUL,2023,8,15,12:30,2023-11-22 11:37:47
Tuesday August 15 2023,12:30 PM,US,2.0,Import Prices MoM JUL,2023,8,15,12:30,2023-11-22 11:37:47
Tuesday August 15 2023,12:30 PM,US,2.0,NY Empire State Manufacturing Index AUG,2023,8,15,12:30,2023-11-22 11:37:47
Tuesday August 15 2023,12:30 PM,US,2.0,Export Prices MoM JUL,2023,8,15,12:30,2023-11-22 11:37:47
Tuesday August 15 2023,12:30 PM,US,1.0,Export Prices YoY JUL,2023,8,15,12:30,2023-11-22 11:37:47
Tuesday August 15 2023,12:30 PM,US,1.0,Import Prices YoY JUL,2023,8,15,12:30,2023-11-22 11:37:47
Tuesday August 15 2023,12:30 PM,US,1.0,Retail Sales Ex Gas/Autos MoM JUL,2023,8,15,12:30,2023-11-22 11:37:47
Tuesday August 15 2023,12:30 PM,US,1.0,Retail Sales YoY JUL,2023,8,15,12:30,2023-11-22 11:37:47
Tuesday August 15 2023,12:55 PM,US,1.0,Redbook YoY AUG/12,2023,8,15,12:55,2023-11-22 11:37:47
Tuesday August 15 2023,02:00 PM,US,2.0,Business Inventories MoM JUN,2023,8,15,14:00,2023-11-22 11:37:47
Tuesday August 15 2023,02:00 PM,US,2.0,NAHB Housing Market Index AUG,2023,8,15,14:00,2023-11-22 11:37:47
Tuesday August 15 2023,02:00 PM,US,1.0,Retail Inventories Ex Autos MoM JUN,2023,8,15,14:00,2023-11-22 11:37:47
Tuesday August 15 2023,08:00 PM,US,2.0,Net Long-term TIC Flows JUN,2023,8,15,20:00,2023-11-22 11:37:47
Tuesday August 15 2023,08:00 PM,US,1.0,Overall Net Capital Flows JUN,2023,8,15,20:00,2023-11-22 11:37:47
Tuesday August 15 2023,08:00 PM,US,1.0,Foreign Bond Investment JUN,2023,8,15,20:00,2023-11-22 11:37:47
Tuesday August 15 2023,08:30 PM,US,2.0,API Crude Oil Stock Change AUG/11,2023,8,15,20:30,2023-11-22 11:37:47
Monday July 31 2023,06:00 PM,US,1.0,Loan Officer Survey,2023,7,31,18:00,2023-11-22 11:37:47
Wednesday August 02 2023,03:30 PM,US,1.0,17-Week Bill Auction,2023,8,2,15:30,2023-11-22 11:37:47
Tuesday August 08 2023,03:30 PM,US,1.0,52-Week Bill Auction,2023,8,8,15:30,2023-11-22 11:37:47
Tuesday August 08 2023,05:00 PM,US,1.0,3-Year Note Auction,2023,8,8,17:00,2023-11-22 11:37:47
Wednesday August 09 2023,05:00 PM,US,1.0,10-Year Note Auction,2023,8,9,17:00,2023-11-22 11:37:47
Wednesday August 16 2023,11:00 AM,US,2.0,MBA 30-Year Mortgage Rate AUG/11,2023,8,16,11:00,2023-11-22 11:37:47
Wednesday August 16 2023,11:00 AM,US,1.0,MBA Mortgage Market Index AUG/11,2023,8,16,11:00,2023-11-22 11:37:47
Wednesday August 16 2023,11:00 AM,US,1.0,MBA Mortgage Refinance Index AUG/11,2023,8,16,11:00,2023-11-22 11:37:47
Wednesday August 16 2023,11:00 AM,US,1.0,MBA Purchase Index AUG/11,2023,8,16,11:00,2023-11-22 11:37:47
Wednesday August 16 2023,11:00 AM,US,1.0,MBA Mortgage Applications AUG/11,2023,8,16,11:00,2023-11-22 11:37:47
Wednesday August 16 2023,12:30 PM,US,3.0,Building Permits Prel JUL,2023,8,16,12:30,2023-11-22 11:37:47
Wednesday August 16 2023,12:30 PM,US,2.0,Building Permits MoM Prel JUL,2023,8,16,12:30,2023-11-22 11:37:47
Wednesday August 16 2023,12:30 PM,US,2.0,Housing Starts JUL,2023,8,16,12:30,2023-11-22 11:37:47
Wednesday August 16 2023,12:30 PM,US,2.0,Housing Starts MoM JUL,2023,8,16,12:30,2023-11-22 11:37:47
Wednesday August 16 2023,01:15 PM,US,2.0,Industrial Production YoY JUL,2023,8,16,13:15,2023-11-22 11:37:47
Wednesday August 16 2023,01:15 PM,US,2.0,Industrial Production MoM JUL,2023,8,16,13:15,2023-11-22 11:37:47
Wednesday August 16 2023,01:15 PM,US,1.0,Manufacturing Production YoY JUL,2023,8,16,13:15,2023-11-22 11:37:47
Wednesday August 16 2023,01:15 PM,US,1.0,Manufacturing Production MoM JUL,2023,8,16,13:15,2023-11-22 11:37:47
Wednesday August 16 2023,01:15 PM,US,1.0,Capacity Utilization JUL,2023,8,16,13:15,2023-11-22 11:37:47
Wednesday August 16 2023,02:30 PM,US,2.0,EIA Crude Oil Stocks Change AUG/11,2023,8,16,14:30,2023-11-22 11:37:47
Wednesday August 16 2023,02:30 PM,US,2.0,EIA Gasoline Stocks Change AUG/11,2023,8,16,14:30,2023-11-22 11:37:47
Wednesday August 16 2023,02:30 PM,US,1.0,EIA Heating Oil Stocks Change AUG/11,2023,8,16,14:30,2023-11-22 11:37:47
Wednesday August 16 2023,02:30 PM,US,1.0,EIA Refinery Crude Runs Change AUG/11,2023,8,16,14:30,2023-11-22 11:37:47
Wednesday August 16 2023,02:30 PM,US,1.0,EIA Cushing Crude Oil Stocks Change AUG/11,2023,8,16,14:30,2023-11-22 11:37:47
Wednesday August 16 2023,02:30 PM,US,1.0,EIA Distillate Fuel Production Change AUG/11,2023,8,16,14:30,2023-11-22 11:37:47
Wednesday August 16 2023,02:30 PM,US,1.0,EIA Distillate Stocks Change AUG/11,2023,8,16,14:30,2023-11-22 11:37:47
Wednesday August 16 2023,02:30 PM,US,1.0,EIA Gasoline Production Change AUG/11,2023,8,16,14:30,2023-11-22 11:37:47
Wednesday August 16 2023,02:30 PM,US,1.0,EIA Crude Oil Imports Change AUG/11,2023,8,16,14:30,2023-11-22 11:37:47
Wednesday August 16 2023,06:00 PM,US,3.0,FOMC Minutes,2023,8,16,18:00,2023-11-22 11:37:47
Thursday August 17 2023,12:30 PM,US,2.0,Initial Jobless Claims AUG/12,2023,8,17,12:30,2023-11-22 11:37:47
Thursday August 17 2023,12:30 PM,US,2.0,Philadelphia Fed Manufacturing Index AUG,2023,8,17,12:30,2023-11-22 11:37:47
Thursday August 17 2023,12:30 PM,US,1.0,Philly Fed Business Conditions AUG,2023,8,17,12:30,2023-11-22 11:37:47
Thursday August 17 2023,12:30 PM,US,1.0,Philly Fed CAPEX Index AUG,2023,8,17,12:30,2023-11-22 11:37:47
Thursday August 17 2023,12:30 PM,US,1.0,Philly Fed Employment AUG,2023,8,17,12:30,2023-11-22 11:37:47
Thursday August 17 2023,12:30 PM,US,1.0,Philly Fed New Orders AUG,2023,8,17,12:30,2023-11-22 11:37:47
Thursday August 17 2023,12:30 PM,US,1.0,Philly Fed Prices Paid AUG,2023,8,17,12:30,2023-11-22 11:37:47
Thursday August 17 2023,12:30 PM,US,1.0,Jobless Claims 4-week Average AUG/12,2023,8,17,12:30,2023-11-22 11:37:47
Thursday August 17 2023,12:30 PM,US,1.0,Continuing Jobless Claims AUG/05,2023,8,17,12:30,2023-11-22 11:37:47
Thursday August 17 2023,02:00 PM,US,1.0,CB Leading Index MoM JUL,2023,8,17,14:00,2023-11-22 11:37:47
Thursday August 17 2023,02:30 PM,US,1.0,EIA Natural Gas Stocks Change AUG/11,2023,8,17,14:30,2023-11-22 11:37:47
Thursday August 17 2023,03:30 PM,US,1.0,4-Week Bill Auction,2023,8,17,15:30,2023-11-22 11:37:47
Thursday August 17 2023,03:30 PM,US,1.0,8-Week Bill Auction,2023,8,17,15:30,2023-11-22 11:37:47
Thursday August 17 2023,04:00 PM,US,1.0,15-Year Mortgage Rate AUG/16,2023,8,17,16:00,2023-11-22 11:37:47
Thursday August 17 2023,04:00 PM,US,1.0,30-Year Mortgage Rate AUG/16,2023,8,17,16:00,2023-11-22 11:37:47
Friday August 18 2023,05:00 PM,US,1.0,Baker Hughes Oil Rig Count AUG/18,2023,8,18,17:00,2023-11-22 11:37:47
Friday August 18 2023,05:00 PM,US,1.0,Baker Hughes Total Rig Count AUG/18,2023,8,18,17:00,2023-11-22 11:37:47
Monday August 21 2023,03:30 PM,US,1.0,3-Month Bill Auction,2023,8,21,15:30,2023-11-22 11:37:47
Monday August 21 2023,03:30 PM,US,1.0,6-Month Bill Auction,2023,8,21,15:30,2023-11-22 11:37:47
Tuesday August 22 2023,12:55 PM,US,1.0,Redbook YoY AUG/19,2023,8,22,12:55,2023-11-22 11:37:47
Tuesday August 22 2023,02:00 PM,US,2.0,Existing Home Sales JUL,2023,8,22,14:00,2023-11-22 11:37:47
Tuesday August 22 2023,02:00 PM,US,2.0,Existing Home Sales MoM JUL,2023,8,22,14:00,2023-11-22 11:37:47
Tuesday August 22 2023,02:00 PM,US,1.0,Richmond Fed Manufacturing Index AUG,2023,8,22,14:00,2023-11-22 11:37:47
Tuesday August 22 2023,02:00 PM,US,1.0,Richmond Fed Manufacturing Shipments Index AUG,2023,8,22,14:00,2023-11-22 11:37:47
Tuesday August 22 2023,02:00 PM,US,1.0,Richmond Fed Services Index AUG,2023,8,22,14:00,2023-11-22 11:37:47
Tuesday August 22 2023,08:30 PM,US,2.0,API Crude Oil Stock Change AUG/18,2023,8,22,20:30,2023-11-22 11:37:47
Wednesday August 23 2023,11:00 AM,US,2.0,MBA 30-Year Mortgage Rate AUG/18,2023,8,23,11:00,2023-11-22 11:37:47
Wednesday August 23 2023,11:00 AM,US,1.0,MBA Mortgage Market Index AUG/18,2023,8,23,11:00,2023-11-22 11:37:47
Wednesday August 23 2023,11:00 AM,US,1.0,MBA Mortgage Refinance Index AUG/18,2023,8,23,11:00,2023-11-22 11:37:47
Wednesday August 23 2023,11:00 AM,US,1.0,MBA Purchase Index AUG/18,2023,8,23,11:00,2023-11-22 11:37:47
Wednesday August 23 2023,11:00 AM,US,1.0,MBA Mortgage Applications AUG/18,2023,8,23,11:00,2023-11-22 11:37:47
Wednesday August 23 2023,01:45 PM,US,2.0,S&P Global Composite PMI Flash AUG,2023,8,23,13:45,2023-11-22 11:37:47
Wednesday August 23 2023,01:45 PM,US,2.0,S&P Global Manufacturing PMI Flash AUG,2023,8,23,13:45,2023-11-22 11:37:47
Wednesday August 23 2023,01:45 PM,US,2.0,S&P Global Services PMI Flash AUG,2023,8,23,13:45,2023-11-22 11:37:47
Wednesday August 23 2023,02:00 PM,US,2.0,New Home Sales JUL,2023,8,23,14:00,2023-11-22 11:37:47
Wednesday August 23 2023,02:00 PM,US,2.0,New Home Sales MoM JUL,2023,8,23,14:00,2023-11-22 11:37:47
Wednesday August 23 2023,02:30 PM,US,2.0,EIA Gasoline Stocks Change AUG/18,2023,8,23,14:30,2023-11-22 11:37:47
Wednesday August 23 2023,02:30 PM,US,2.0,EIA Crude Oil Stocks Change AUG/18,2023,8,23,14:30,2023-11-22 11:37:47
Wednesday August 23 2023,02:30 PM,US,1.0,EIA Cushing Crude Oil Stocks Change AUG/18,2023,8,23,14:30,2023-11-22 11:37:47
Wednesday August 23 2023,02:30 PM,US,1.0,EIA Distillate Fuel Production Change AUG/18,2023,8,23,14:30,2023-11-22 11:37:47
Wednesday August 23 2023,02:30 PM,US,1.0,EIA Distillate Stocks Change AUG/18,2023,8,23,14:30,2023-11-22 11:37:47
Wednesday August 23 2023,02:30 PM,US,1.0,EIA Gasoline Production Change AUG/18,2023,8,23,14:30,2023-11-22 11:37:47
Wednesday August 23 2023,02:30 PM,US,1.0,EIA Heating Oil Stocks Change AUG/18,2023,8,23,14:30,2023-11-22 11:37:47
Wednesday August 23 2023,02:30 PM,US,1.0,EIA Refinery Crude Runs Change AUG/18,2023,8,23,14:30,2023-11-22 11:37:47
Wednesday August 23 2023,02:30 PM,US,1.0,EIA Crude Oil Imports Change AUG/18,2023,8,23,14:30,2023-11-22 11:37:47
Wednesday August 23 2023,08:00 PM,US,1.0,Building Permits Final JUL,2023,8,23,20:00,2023-11-22 11:37:47
Wednesday August 23 2023,08:00 PM,US,1.0,Building Permits MoM Final JUL,2023,8,23,20:00,2023-11-22 11:37:47
Thursday August 24 2023,12:30 PM,US,3.0,Durable Goods Orders MoM JUL,2023,8,24,12:30,2023-11-22 11:37:47
Thursday August 24 2023,12:30 PM,US,2.0,Durable Goods Orders Ex Transp MoM JUL,2023,8,24,12:30,2023-11-22 11:37:47
Thursday August 24 2023,12:30 PM,US,2.0,Initial Jobless Claims AUG/19,2023,8,24,12:30,2023-11-22 11:37:47
Thursday August 24 2023,12:30 PM,US,2.0,Chicago Fed National Activity Index JUL,2023,8,24,12:30,2023-11-22 11:37:47
Thursday August 24 2023,12:30 PM,US,1.0,Continuing Jobless Claims AUG/12,2023,8,24,12:30,2023-11-22 11:37:47
Thursday August 24 2023,12:30 PM,US,1.0,Jobless Claims 4-week Average AUG/19,2023,8,24,12:30,2023-11-22 11:37:47
Thursday August 24 2023,12:30 PM,US,1.0,Non Defense Goods Orders Ex Air JUL,2023,8,24,12:30,2023-11-22 11:37:47
Thursday August 24 2023,12:30 PM,US,1.0,Durable Goods Orders ex Defense MoM JUL,2023,8,24,12:30,2023-11-22 11:37:47
Thursday August 24 2023,02:30 PM,US,1.0,EIA Natural Gas Stocks Change AUG/18,2023,8,24,14:30,2023-11-22 11:37:47
Thursday August 24 2023,03:00 PM,US,1.0,Kansas Fed Composite Index AUG,2023,8,24,15:00,2023-11-22 11:37:47
Thursday August 24 2023,03:00 PM,US,1.0,Kansas Fed Manufacturing Index AUG,2023,8,24,15:00,2023-11-22 11:37:47
Thursday August 24 2023,03:30 PM,US,1.0,4-Week Bill Auction,2023,8,24,15:30,2023-11-22 11:37:47
Thursday August 24 2023,03:30 PM,US,1.0,8-Week Bill Auction,2023,8,24,15:30,2023-11-22 11:37:47
Thursday August 24 2023,04:00 PM,US,1.0,15-Year Mortgage Rate AUG/23,2023,8,24,16:00,2023-11-22 11:37:47
Thursday August 24 2023,04:00 PM,US,1.0,30-Year Mortgage Rate AUG/23,2023,8,24,16:00,2023-11-22 11:37:47
Friday August 25 2023,02:00 PM,US,2.0,Michigan Consumer Sentiment Final AUG,2023,8,25,14:00,2023-11-22 11:37:47
Friday August 25 2023,02:00 PM,US,1.0,Michigan 5 Year Inflation Expectations Final AUG,2023,8,25,14:00,2023-11-22 11:37:47
Friday August 25 2023,02:00 PM,US,1.0,Michigan Consumer Expectations Final AUG,2023,8,25,14:00,2023-11-22 11:37:47
Friday August 25 2023,02:00 PM,US,1.0,Michigan Current Conditions Final AUG,2023,8,25,14:00,2023-11-22 11:37:47
Friday August 25 2023,02:00 PM,US,1.0,Michigan Inflation Expectations Final AUG,2023,8,25,14:00,2023-11-22 11:37:47
Friday August 25 2023,05:00 PM,US,1.0,Baker Hughes Oil Rig Count AUG/25,2023,8,25,17:00,2023-11-22 11:37:47
Friday August 25 2023,05:00 PM,US,1.0,Baker Hughes Total Rig Count AUG/25,2023,8,25,17:00,2023-11-22 11:37:47
Tuesday August 01 2023,09:30 AM,US,1.0,LMI Logistics Managers Index Current JUL,2023,8,1,09:30,2023-11-22 11:37:47
Wednesday August 02 2023,01:10 PM,US,1.0,Total Vehicle Sales JUL,2023,8,2,13:10,2023-11-22 11:37:47
Monday August 28 2023,02:30 PM,US,2.0,Dallas Fed Manufacturing Index AUG,2023,8,28,14:30,2023-11-22 11:37:47
Monday August 28 2023,03:30 PM,US,1.0,3-Month Bill Auction,2023,8,28,15:30,2023-11-22 11:37:47
Monday August 28 2023,03:30 PM,US,1.0,6-Month Bill Auction,2023,8,28,15:30,2023-11-22 11:37:47
Tuesday August 29 2023,12:55 PM,US,1.0,Redbook YoY AUG/26,2023,8,29,12:55,2023-11-22 11:37:47
Tuesday August 29 2023,01:00 PM,US,2.0,S&P/Case-Shiller Home Price MoM JUN,2023,8,29,13:00,2023-11-22 11:37:47
Tuesday August 29 2023,01:00 PM,US,2.0,S&P/Case-Shiller Home Price YoY JUN,2023,8,29,13:00,2023-11-22 11:37:47
